2018-01-31,글로본,6.99,中 메이더 무역유한공사와 214.30억원 규모 공급계약 체결에 상한가,"▷동사는 中 메이더 무역유한공사(OROSA)와 214.30억원 규모의 화장품 등 물품 공급계약을 체결했다고 공시. 이는 2016년 매출액 대비 143.21%에 해당하는 금액이며, 계약기간은 2018년2월1일부터 2019년1월31일까지임."
2018-01-31,아이리버,5.79,최대주주인 SK텔레콤의 음악사업 진출 소식에 상한가,"▷동사의 최대주주인 SK텔레콤은 언론을 통해 SM엔터테인먼트·JYP엔터테인먼트·빅히트 엔터테인먼트와 함께 신규 음악 플랫폼을 론칭할 예정이라고 밝힘.▷SK텔레콤과 엔터테인먼트 3사는 연내 음악 플랫폼 사업을 시작하기 위해 긴밀히 협력하기로 했으며, 특히 오는 2월1일부터 SK텔레콤의 자회사인 동사가 엔터테인먼트 3사 음원의 B2B 유통 운영을 맡는 계약도 함께 체결했음."
2018-01-31,GMR머티리얼즈,4.69,지난해 흑자전환에 급등,"▷동사는 전일 장 마감 후 연결기준 지난해 영업이익과 순이익이 6.13억원, 2.21억원으로 전년대비 흑자전환했다고 공시. 같은기간 매출액은 1,149.93억원으로 전년대비 72.0% 증가."
2018-01-31,동화기업,4.23,해외 성장 기대감에 강세,"▷케이프투자증권은 동사에 대해 17년3분기 10%중반까지 마진율이 하락했지만, 2라인 가동 기간 증가에 따른 수율 안정화와 박판 생산 확대를 통한 ASP 상승, 고무가격의 안정화 등으로 인해 베트남 내 MDF 사업의 마진율은 점진적으로 회복세에 진입할 것으로 전망.▷아울러 17년 M&A(태양합성, 코트카밀 임프렉스)를 통한 실적 개선과 함께 신규 국가로의 목재사업 진출 가능성을 감안할 시 동사의 해외 성장 모멘텀은 유효하다고 밝힘.▷투자의견 : 매수[유지], 목표주가 : 50,000원[유지]"
2018-01-31,클래시스,2.39,실적 성장 기대감에 강세,▷하나금융투자는 동사에 대해 미용 의료기기 제품군의 매출 성장 및 개인 미용기기 시장 진출에 따른 실적 성장이 기대된다고 분석.▷금일 신규추천 종목에 편입.
2018-01-31,아진산업,2.37,유상증자 권리락 효과에 상승,"▷동사는 전일 장 마감 후 유상증자로 인한 권리락 효과가 금일 발생한다고 공시. 기준가격은 5,230원임."
2018-01-31,유아이엘,2.31,지난해 실적 호조 및 자사주 취득 결정 등으로 상승,"▷동사는 연결기준 지난해 영업이익 및 매출액이 각각 239.86억원, 4,797.84억원을 기록해 전년대비 19.5%, 7.9% 증가했다고 공시. 다만, 같은 기간 순이익은 165.74억원을 기록해 전년대비 0.1% 감소.▷아울러 동사는 전일 장 마감 후 주식가격 안정 및 주주가치 제고를 목적으로 보통주 800,000주(52.32억원) 규모 자사주 취득을 결정했다고 공시. 취득예상기간은 2018년1월31일부터 2018년4월30일까지임. 또한, 보통주 1주당 350원을 배당하는 현금배당도 결정했다고 공시."
2018-01-31,성도이엔지,2,160억원 규모 건설공사 계약 체결에 상승,"▷동사는 (주)코템과 160억원 규모 제3공장 건설 공사 계약을 체결했다고 공시. 이는 2016년 매출액대비 3.76% 규모이며, 계약기간은 2018년1월30일부터 2018년11월30일까지임."
2018-01-31,에스엠코어,1.13,지난해 실적 호조 및 현금배당 결정에 상승,"▷동사는 연결기준 지난해 영업이익이 5.58억원을 기록해 전년대비 흑자전환했다고 공시. 같은 기간 매출액은 724.14억원을 기록해 전년대비 43.7% 증가했으며, 순손실은 18.72억원으로 전년대비 적자폭이 축소.▷아울러 보통주 1주당 현금 50원을 배당하는 현금배당을 결정했다고 공시. 배당기준일은 2017년12월31일임."
2018-01-31,뉴트리바이오텍,-19.44,실적 개선 기대감에 소폭 상승,"▷키움증권은 전일 동사에 대해 지난 4분기 실적이 컨센서스를 충족했다며, 올해 상반기에도 중국 수출 관련 기저효과와 미국법인 매출 증가로 실적 개선이 기대된다고 분석.  ▷아울러 국내외 건강 기능식품 성장에 따른 중장기적 수혜가 기대되는 가운데, 전사 이익이 고성장하면서 밸류에이션 프리미엄이 유지될 것으로 기대된다고 분석. ▷투자의견 : 매수[유지], 목표주가 : 26,000원 →30,000원[상향]"
2018-01-31,아이앤씨,29.97,지난해 실적 호조에 상승,"▷동사는 연결기준 지난해 영업이익이 65.65억원을 기록해 전년대비 1,268.6% 증가했다고 공시. 같은 기간 매출액은 429.30억원을 기록해 전년대비 41.7% 증가했으며, 순이익은 전년대비 298.6% 증가한 58.53억원을 기록."
2018-01-31,스튜디오드래곤,11.72,드라마 '크로스' 흥행 기대감 등으로 소폭 상승,"▷이베스트투자증권은 동사에 대해 금주 월화 방영된 tvN 새 월화극 크로스(스튜디오드래곤/로고스필름 제작) 1화 시청률이 닐슨코리아 전국기준 3.9%를 기록하며 쾌조의 출발을 했다고 밝힘. 이에 2016년5월 또! 오해영 이후 약했던 월화극 라인업 활력이 기대된다고 분석.▷아울러 드라마 제작물량, 화제성, 시청률 측면에서 경쟁력의 압도적인 우위가 지속 확인되고 있고, 넷플릭스 라이브러리 확대의 최대 수혜주이며, 중국 수출 재개 기대감도 올해 중으로는 가시화될 것으로 전망.▷투자의견 : BUY[유지], 목표주가 : 100,000원[유지]"
2018-01-31,한컴MDS,6.74,지난해 실적 부진에 하락,"▷동사는 연결기준 지난해 영업이익이 113.02억원을 기록해 전년대비 16.6% 감소했다고 공시. 같은 기간 매출액은 1,489.41억원을 기록해 전년대비 0.9% 감소했으며, 순이익은 전년대비 15.4% 감소한 92.78억원을 기록.▷이에 유진투자증권은 정보가전 및 산업용 매출이 급감하면서 본사 매출이 감소하였고, 본사 매출액 감소로 인한 고정비용 부담 등으로 영업이익 또한 감소했다고 분석. 다만, 올해는 실적 개선세에 접어들 것으로 분석. ▷투자의견 : BUY[유지], 목표주가 : 26,700원[유지]"
2018-01-31,서울반도체,4.95,지난해 4분기 실적 부진에 약세,"▷동사는 전일 연결기준 4분기 영업이익 및 순이익이 각각 199.92억원, 3.65억원을 기록해 전년동기대비 2.5%, 98.1% 감소했다고 공시. 같은기간 매출액은 2,827.35억원으로 전년동기대비 17.1% 증가.▷이와 관련 하나금융투자는 동사에 대해 환율 영향과 제품믹스 악화, 그리고 계절적 요인 등으로 인해 4분기 실적이 컨센서스를 크게 하회했다며, 외형 성장에도 불구하고 수익성이 저조해 향후 실적 불확실성이 상존한다고 밝힘.▷투자의견 : Neutral[유지], 목표주가 : 27,000원[유지]"
2018-01-30,리켐,4.25,219.99억원 규모 자금조달 기대감에 상한가,"▷동사는 회사의 경영 목적 달성 및 신속한 자금조달을 위해 (주)팜앤파머컴퍼니를 대상으로 119.99억원(12,765,957주) 규모 제3자배정 유상증자를 결정했다고 공시. 신주 발행가액은 940원이며, 신주상장예정일은 2018년3월14일임. ▷아울러 운영자금 마련을 목적으로 지앤디솔루션(주)과 (주)메이크올 대상으로 총 100억원규모 무기명식 무보증 사모전환사채발행을 결정했다고 공시. 사채의 만기이자율은 3%이며, 사채의만기일은 2021년2월26일임."
2018-01-30,에스제이케이,4.09,비트윈그룹과 암호 연산기 독점 생산 및 공급 제휴 소식에 상한가,"▷동사는 언론을 통해 비트윈그룹과 SHA-256 암호 연산기를 독점 생산 및 공급하기로 전략적 제휴를 맺었다고 밝힘. 암호 연산기는 블록체인 기반의 SHA-256 알고리즘을 고속 연산하는 하드웨어로써, 암호화폐 생성과 블록체인 솔루션의 운영에 활용될 것으로 알려짐. ▷한편, 회사측은 ""올해 200만대 이상의 수요가 예측되는 AISC 기반 암호 연산기 시장에 한국이 최초로 진출한 것이라며, 전 세계적으로 수요에 비해 공급이 절대적으로 부족한 만큼 매출 증대와 이익률 개선이 예상된다”고 밝힘."
2018-01-30,대유위니아,3.77,외형 성장 및 수익성 개선 기대감에 급등,"▷이베스트투자증권은 동사에 대해 김치냉장고(딤채)가 차지하는 비중이 절대적이기 때문에 실적 계절성을 보이지만, 에어컨을 중심으로(벽걸이형) 중소형 세탁기, 제습기 등 주방/생활가전 부문의 매출 성장으로 안정적인 외형 성장이 기대된다고 분석. 아울러 주방/생활가전 부문의 매출 성장과 더불어 지난해 본사 이전 관련 이슈에 따른 일회성 비용 해소로 수익성 역시 개선될 것으로 기대."
2018-01-30,신신제약,3.61,342.50억원 규모 세종공장 건립 소식에 상승,"▷동사는 내수 증대와 수출을 위한 미래성장 동력 확보를 목적으로 342.50억원 규모 신규 시설투자(세종공장 건립)를 결정했다고 공시. 이는 자기자본대비 99.48% 규모이며, 투자기간은 2018년2월1일부터 2019년8월31일까지임."
2018-01-30,골든센츄리,2.42,무상증자 권리락 효과에 상승,"▷동사는 전일 장 마감 후 무상증자에 따른 권리락이 금일 발생한다고 공시. 기준가는 1,760원임."
2018-01-30,태양씨앤엘,2.12,지난해 영업이익 흑자전환에 상승,"▷동사는 연결기준 지난해 영업이익이 53.65억원을 기록해 전년대비 흑자전환했다고 공시. 다만, 같은 기간 매출액은 202.01억원을 기록해 전년대비 52.31% 감소했으며, 순손실은 99.03억원을 기록해 적자가 지속됐다고 밝힘."
2018-01-30,아프리카TV,1.35,외형 성장 지속 분석에 소폭 상승,"▷IBK투자증권은 동사에 대해 지난해 4분기 실적은 매출액 260억원(yoy +22%, qoq +5%), 영업이익 49억원(yoy -4%, qoq +0%)을 기록할 전망이라며, 4분기에도 아이템 매출 성장은 지속될 전망이라고 분석. BJ 지원 강화에 따른 콘텐츠 다변화로 결제 유저 비중 및 ARPU(가입자당 평균매출)가 높아졌을 것으로 추정되지만, 인센티브 지급에 따른 인건비 상승과 BJ 시상식 개최 비용 4~5억원 수준 발생으로 영업 비용 역시 확대되었을 것으로 예상. ▷한편, 지난해 상반기 진행된 화질 개선 작업에 따른 고정비 지출 확대와 BJ 지원 확대로 기존 추정치 대비 영업비용을 상향 조정했으며, 이에 목표주가를 하향 조정함.▷투자의견 : BUY[유지], 목표주가 : 37,000원 →31,000원[하향]"
2018-01-30,펩트론,1.02,255원 규모 CB발행 결정에 소폭 상승,"▷동사는 운영자금 마련을 목적으로 중소기업은행 대상 255억원 규모 무기명식 이권부 무보증 사모 전환사채를 발행키로 결정했다고 공시. 사채의 표면/만기이자율은 각각 0.5%, 2.0%이며, 사채의 만기일은 2023년1월31일임.▷한편, 동사는 언론을 통해 작년 연말 완공된 약효지속성 의약품 공장이 올해 시운전, GMP 벨리데이션 등을 진행함과 동시에 연구개발, 해외임상시료 생산 등도 본격 추진될 예정이라며, 이를 위한 자금 확보를 목적으로 이번 자금조달을 진행했다고 밝힘."
2018-01-30,셀바스AI,-2.94,'셀비 체크업' API 일본 시장 진출 소식에 소폭 상승,"▷동사는 언론을 통해 일본 최대 통신사업자인 KDDI와 손잡고 '셀비 체크업' 앱 프로그래밍 인터페이스(API)를 일본 시장에 공개한다고 밝힘. '셀비 체크업' API는 KDDI가 새롭게 오픈하는 ‘KDDI IoT Cloud API Market’에 공개될 예정임. ▷한편, '셀비 체크업'은 딥러닝 기술이 적용된 질병예측 서비스로 개인의 건강검진기록을 입력하면 주요 6대암의 발병 위험과 주요 성인병의 4년이내 발병 확률을 예측할 수 있는 것으로 알려짐."
2018-01-30,성도이엔지,-15.02,신신제약과 306억원 규모 공사계약 체결에 소폭 상승,"▷동사는 신신제약(주)과 306억원 규모의 신신제약(주) 세종시 GMP 공장 신축공사 계약을 체결했다고 공시. 이는 2016년 매출액 대비 7.19% 규모이며, 계약 기간은 2018년2월1일부터 2019년2월28일까지임."
2018-01-30,비아트론,-15.03,中 업체와 487.65억원 규모 디스플레이용 제조장비 공급계약 체결에 소폭 상승,"▷동사는 BOE Optoelectronics Technology Co., Ltd(중국)와 487.65억원 규모의 디스플레이용 제조장비 공급계약을 체결했다고 공시. 이는 2016년 매출액 대비 63.81%에 해당하는 금액이며, 계약 기간은 2018년1월30일부터 2018년10월4일까지임."
2018-01-30,뉴트리바이오텍,24.39,지난해 실적 부진에 소폭 하락,"▷동사는 연결기준 지난해 영업이익 및 순이익이 각각 115.30억원, 46.43억원을 기록해 전년대비 38.6%, 72.9% 감소했다고 공시. 다만, 같은 기간 매출액은 1,363.51억원을 기록해 전년대비 12.9% 증가."
2018-01-29,제이스테판,15.83,상장 유지 결정 속 거래재개 첫날 상한가,"▷한국거래소 코스닥본부는 동사에 대해 16년도 (정정)감사보고서상 주권의 상장폐지 사유를 해소(감사의견 적정)함에 따라, 코스닥시장상장규정 제38조 및 제40조에 의거 동사 주권의 상장유지를 결정했다고 공시. 이에 지난 2017년 3월24일부터 거래가 정지됐던 동사의 주가가 금일 거래재개됨."
2018-01-29,이젠텍,9.32,대규모 자금조달 기대감에 급등,"▷동사는 타법인 증권취득자금 마련 등을 목적으로 보통주 7,188,699주(279.99억원) 규모 제3자배정 유상증자를 결정했다고 공시. 신주의 발행가액은 3,895원이며, 신주의 상장예정일은 2018년4월6일임. 제3자배정 대상자는 주요주주인 (주)라이트론 등임. ▷아울러 운영자금 마련 등을 목적으로 주요주주인 (주)라이트론 등 대상 총 220억원 규모 무기명식 이권부 무보증 사모 전환사채를 발행키로 결정했다고 공시. 사채의 표면/만기이자율은 모두 3%임."
2018-01-29,세미콘라이트,9.22,특수관계인 대상 69.99억원 규모 제3자배정 유상증자 결정 속 거래재개 첫날 급등,"▷동사는 타법인증권 취득자금 및 운영자금을 위해 특수관계인 (주)에스엠씨홀딩스를 대상으로 69.99억원(5,957,446주) 규모 제3자배정 유상증자를 결정했다고 공시. 신주 발행가액은 1,175원이며, 신주의상장예정일은 2018년4월17일임. 한편, 에스엠홀딩스는 동사의 김영진 대표가 지분50%를 보유하고 있음. ▷한편, 지난 2017년3월30일부터 거래가 정지됐던 동사의 주가는 상장폐지 사유 해소로 금일 거래가 재개됐음."
2018-01-29,선광,8.18,지난해 호실적에 급등,"▷동사는 지난 26일 장 마감 후 지난해 연결기준 영업이익과 매출액이 208.00억원, 1,435.92억원을 기록해 전년대비 각각 56.0%, 12.1% 증가했다고 공시. 다만, 같은기간 순이익은 72.03억원으로 전년대비 65.4% 감소."
2018-01-29,아우딘퓨쳐스,7,ODM 부문 정상화 기대감에 강세,"▷한국투자증권은 동사에 대해 17년3분기 누적 ODM 매출액이 87억원으로 전년동기대비 61.8% 감소했지만, 올해 사드 이슈 해소로 인해 ODM 부문의 턴어라운드가 예상된다고 밝힘. 이에 따라 올해 매출액 및 영업이익은 각각 828억원(+66.9% YoY), 100억원(+406.5% YoY)을 기록할 것으로 전망.▷한편, 동사는 아모레퍼시픽, 메디힐 등의 주요 업체들을 고객사로 두고 17년에는 카버코리아, 닥터자르트, Roberts 등의 신규 고객사를 확보했으며, 특히 17년 자체 브랜드 NEOGEN으로 중국에 직접 진출함에 따라 중국 내 한국 화장품 판매 정상화에 따른 수혜가 과거 대비 클 것으로 분석."
2018-01-29,동운아나텍,6.94,中 듀얼카메라 시장 확대 수혜 기대감에 강세,"▷한양증권은 동사에 대해 중국 듀얼카메라 시장 확대에 따른 수혜가 기대된다고 분석. 최근 핸셋을 비롯한 IT 업종에 대한 노이즈에도 불구하고 동사는 문제가 되고 있는 미국 A사에 제품 공급을 하지 않는다며, 이번 문제로 화웨이, 오포, 비보 등 중국향 매출비중이 높은 동사가 반사이익을 누릴것으로 분석. 특히, 올해부터 중국 프리미엄 제품에 Closed Loop AF Driver IC칩이 적용된 듀얼카메라 탑재 가능성이 높이 보이는 만큼 업종내 노이즈가 없는 점이 프리미엄 요인이라고 분석.▷아울러 듀얼카메라에 사용되는 AF IC의경우 기존 제품 대비 단가가 높아 매출과 이익성장에 긍정적인 점과 신제품 Haptic DriverIC에 대한 수요도 늘어날 것으로 된다며 올해 본격적인 턴어라운드가 기대된다고 분석."
2018-01-29,아프리카TV,6.67,저평가 분석에 강세,"▷유진투자증권은 동사에 대해 개인방송 시장의 구조적 성장이 지속되고 있으며, 실적 또한 그를 반영하듯 2015년 이후 매 분기 성장을 지속하고 있다고 밝힘. 그러나 실적개선에도 불구하고 규제 등에 대한 우려감이 반영되며 주가가 지속 하락하여 현재는 올해 실적추정치 기준 PER이 13.8배 수준에 불과해 저평가 영역에 접어들었다고 분석.▷아울러 E-Sports를 고유 콘텐츠로 더욱 확대해 나갈 계획으로 이를 통해 유저들의 플랫폼 충성도를 높이고, 또한 콘텐츠 경쟁력을 강화해나갈 것으로 전망.▷투자의견 : BUY[유지], 목표주가 : 34,000원[유지]"
2018-01-29,바이로메드,5.74,당뇨병성 신경병증 치료제 'VM202' 기대감에 상승,"▷메리츠종금증권은 동사에 대해 당뇨병 신경병증(DPN) 치료제인 'VM202'의 미국시장에 대한 파이프라인 가치가 최소 5조5,720억원에서 최대 11조2,640억원으로 평가된다고 밝힘. 특히, 임상2상을 통해 기존 치료제 수준의 통증 완화를 입증했으며, 부작용 및 투여 편의성 측면에서의 장점을 갖고있어 향후 시장 진출 시 높은 판매 실적이 기대된다고 밝힘.▷아울러, VM202가 현재 당뇨병성 신경병증 이외에도 당뇨병성 족부궤양(PAD) 및 루게릭병(ALS)에 대한 임상 3상과 2상을 진행중인 점 등을 통해 추가적인 가치 창출이 가능할 것으로 전망."
2018-01-29,한국알콜,5.24,초산에틸 가격 상승 수혜 기대감 등으로 상승,"▷하나금융투자는 동사에 대해 중국 가스대란으로 초산에틸 가격이 급속히 상승하고 있다며, 이는 중장기적으로 동사의 주가에 긍정적이라고 밝힘. 아울러 17년 기준 PER 약 6배로 저평가로 판단된다며, 금일 신규추천 종목으로 편입."
2018-01-29,코텍,4.77,지난해 4분기 호실적 및 올해 실적 개선 기대감에 상승,"▷키움증권은 동사에 대해 지난해 4분기 원화강세 지속에도 불구하고, 매출액 1,016억원(+13% YoY), 영업이익 95억원(+25% YoY)으로 사상 최대 매출액을 기록하며 기존 예상치를 상회했다고 밝힘. 이는 카지노 향 커브드 모델 수 증가로 497억원의 최대 매출을 기록했고, 전자칠판 역시 408억원으로 호조세가 지속되었기 때문으로 분석.▷아울러 올해 실적은 매출액 3,523억원(+8% YoY), 영업이익 384억원(+15% YoY)을 기록할 것으로 전망. 이는 카지노향 매출액 성장을 이끌고 있는 커브드 모니터 모델 수 증가에 따른 ASP 상승효과가 더 가파를 것으로 전망하기 때문으로 분석.▷투자의견 : BUY[유지], 목표주가 : 21,000원[유지]"
2018-01-29,정다운,3.57,지난해 호실적에 상승,"▷동사는 지난 26일 장 마감 후 연결기준 지난해 영업이익이 106.43억원을 기록해 전년대비 226.6% 증가했다고 공시. 같은 기간 매출액은 805.50억원을 기록해 전년대비 39.4% 증가했으며, 순이익은 91.35억원을 기록해 전년대비 흑자전환."
2018-01-29,덕우전자,3.11,지난해 호실적에 상승,"▷동사는 지난해 연결기준 영업이익이 186.66억원을 기록해 전년대비 35.0% 증가했다고 공시. 같은기간 매출액과 순이익은 1,157.28억원, 145.40억원을 기록해 전년대비 각각 49.7%, 35.9% 증가."
2018-01-29,스튜디오드래곤,2.78,고평가 분석에 약세,"▷대신증권은 동사에 대해 올해 넷플릭스 및 중국향 컨텐츠 수출 가능성이 높아진 점을 감안하여 직전 추정대비 영업이익 200억원(40%상향), 목표주가는 74,000원(61%상향)으로 했으나, 당사가 추정하는 적정 주가를 15% 초과하여 거래되고 있기 때문에 투자의견은 시장수익률로 하향한다고 분석. ▷아울러 최근 주가는 중국과의 관계 개선에 따라 중국 판매가 증가할 것이라는 기대가 반영됐지만, 동사는 CJ E&M을 위해 존재하는 회사이기 때문에 중국 수출은 확인하고 넘어가야 한다고 밝힘.▷투자의견 : BUY → Marketperform[하향], 목표주가 : 46,000원 → 74,000원[상향]"
2018-01-26,라이브플렉스,-2.4,신개념 자산거래 시스템 '크립토마블' 오픈 소식에 상한가,"▷동사는 현재 개발 진행 중인 자산거래 시스템 '크립토마블(CryptoMarble)'의 웹사이트를 오픈했다고 밝힘. '크립토마블'은 이더리움 기반의 디지털 자산인 말(馬)을 거래하고 자산가치와 거래내역이 변조될 수 없도록 모두 블록체인에 기록되는 신개념 자산 거래 시스템임.▷한편, 동사는 최근 씨티엘과 합자회사인 ‘크립토컴퍼니’를 설립하고 블록체인과 가상화폐 관련 사업에 박차를 가하겠다고 밝힌 바 있음."
2018-01-26,SIMPAC Metal,10.21,합금철 가격 상승 기대감에 급등,"▷한국투자증권은 중국 정부가 환경문제에 대해 단호한 모습을 보이고 있다며, 이에 환경 오염을 유발하는 합금철 생산이 제한되어 가격 강세가 이어질 것으로 전망. 이에 동사의 올해 매출액 및 영업이익, 순이익은 각각 2,647억원(+19% YoY), 309억원(+55% YoY), 256억원(+57% YoY)으로 업황이 최고조였던 2008년 실적에 견줄만 한 실적을 달성할 것으로 전망. ▷한편, 시가총액의 80%를 상회하는 1,000억원이 넘는 자산가치를 보유하고 있다는 점도 매력적인 투자포인트라고 밝힘.▷투자의견 : 매수[신규], 목표주가 : 20,000원[신규]"
2018-01-26,엔터메이트,9.09,신작 모바일게임 흥행 기대감에 강세,"▷동사는 언론을 통해 신작 모바일 액션 RPG 게임 'FOX(Flame of Xenocide)' 를 2월8일(목)부터 구글플레이 및 애플 앱스토어에서 정식 서비스를 시작한다고 밝힘. FOX는 성인전용 게임임에도 사전 예약자수가 100만명을 돌파하는 이례적 성과를 기록한 것으로 알려짐. ▷한편, FOX는 스텀펑크 스타일의 그래픽과 각각의 전투 스타일을 지닌 캐릭터들로 12종의 스킬을 구사하는 등 다양한 콘텐츠를 이용할 수 있는 게임임."
2018-01-26,서울옥션,8.52,올해 실적 개선 기대감에 강세,"▷한화투자증권은 동사에 대해 올해 매출액과 영업이익은 각각 605억원, 87억원을 기록할 것으로 전망. 이는 2월 홍콩 전시장 오픈에 따른 외형성장과 더물어 수익성 개선까지 확대되어 올해부터 본격적인 실적 개선이 기대되기 때문으로 분석.▷아울러 지난해 4분기 실시된 홍콩 경매, 국내 메이저 경매, 기획경매 모두 성황리 마무리 되는 등 미술품 거래 시장이 다시 활기를 띄고 있어 국내외 경매 흥행이 지속될 것으로 전망."
2018-01-26,제이콘텐트리,7.67,실적 개선 기대감에 상승,"▷신한금융투자는 동사에 대해 지난해 4분기 연결 매출액은 1,122억원(+37.1% YoY, 이하 YoY), 영업이익은 100억원(흑자전환)을 기록할 것으로 전망. 이는 극장 부문 영업이익이 77억원으로 흑자전환이 예상되며, '범죄도시' 관련 배급 수익과 함께 20%를 상회하는 매출 성장률이 기대되기 때문으로 분석.▷아울러 넷플릭스와 중국을 통한 방송 부문 수익성 개선 가속화(18년 영업이익 보수적으로도 36.8% YoY 증가) 등으로 올해에도 실적 개선세를 이어갈 것으로 분석.▷투자의견 : BUY[유지], 목표주가 : 5,700원 → 7,800원[상향]"
