2018-05-15,덕양산업,3.63,中 자동차 부품회사 지분 50% 신규 취득 결정에 급등,"▷동사는 전일 장 마감 후 자동차부품사업 성장동력 추가확보를 위해 선양화천덕양 자동차부품 유한회사(중국) 지분 50%(50.60억원)를 신규 취득키로 결정했다고 공시. 이는 선양화천덕양 자동차부품 유한공사 신규 설립에 지분 50%를 현금 취득하는 것으로, 취득예정일자는 2018년6월29일임."
2018-05-15,남광토건,2.82,"1,063.78억원 규모 공사 수주 및 남북 관계개선 기대감 등으로 강세","▷동사는 한국도로공사로부터 1,063.78억원 규모 새만금-전주간 고속도로 건설공사(제4공구)를 수주했다고 공시. 이는 지난해 매출액 대비 92.01% 규모이며, 계약기간은 2018년5월15일부터 2024년2월12일까지임.▷아울러 최근 남북 관계개선 기대감에 대북 관련주들이 강세를 보이고 있는 점도 긍정적으로 작용."
2018-05-15,도화엔지니어링,2.71,1분기 호실적에 상승,"▷동사는 분기보고서를 통해 연결기준 1분기 영업이익이 32.32억원을 기록해 전년동기대비 31.98% 증가했다고 공시. 같은기간 매출액 및 순이익은 각각 962.91억원, 22.89억원으로 전년동기대비 32.51%, 117.05% 증가."
2018-05-15,엔씨소프트,2.45,리니지M 독자 IP 육성 소식 등에 상승,"▷동사는 금일 서울 역삼동 '더 라움'에서  리니지M 서비스 1주년 미디어 간담회 '이어 원(YEAR ONE)'을 개최하고 자사의 모바일게임 '리니지M'을 독자 IP(지식재산권)로 육성하는 등의 내용을 발표했음.▷김택진 대표이사는 ""리니지를 벗어나 리니지M의 오리지널리티로 새로운 항해를 시작하려 한다""며, ""리니지M만의 콘텐츠와 서비스를 제공하겠다""고 밝힘. 또한, ""리니지M만의 독자적 콘텐츠 도입, 풀HD급(1920×1080)그래픽 업그레이드, 글로벌 서비스 전략을 앞세워 시장을 확대하겠다""고 밝힘."
2018-05-15,다스코,2.31,사우디아라비아 지하철 공사계약 체결 및 남북 관계개선 기대감 등에 상승,"▷동사는 Fast Consortium LLC와 22.92억원 규모 사우디아라비아 리야드메트로 4호선 역사 건축물 내외 장재 공급 및 설치 공사계약을 체결했다고 공시. 이는 지난해 매출액 대비 1.03% 규모이며, 계약기간은 2018년5월12일부터 2019년2월28일까지임.▷아울러 최근 남북 관계개선 기대감으로 남북경협 관련주들이 강세를 보이고 있는 점도 긍정적으로 작용."
2018-05-15,두산건설,2.27,651.65억원 규모 공사 수주 및 남북 관계개선 기대감 등으로 상승,"▷동사는 한국전력공사로부터 651.65억원 규모 광양-여수지역 전기공급시설 전력구공사(광양CC-신여수)를 수주했다고 공시. 이는 지난해 매출액 대비 4.24% 규모이며, 계약기간은 2018년5월14일부터 2022년2월15일까지임.▷아울러 최근 남북 관계개선 기대감에 건설주들이 강세를 보이고 있는 점도 긍정적으로 작용."
2018-05-23,바이로메드,-3.91,당뇨병성 신경병증 치료제 美 FDA 첨단 재생의약 치료제 지정 승인 소식에 급등,"▷동사는 당뇨병성 신경병증 치료제 'VM202'가 美 FDA로부터 첨단 재생의약 치료제(RMAT)로 지정이 승인됐다고 공시.▷이와 관련, 동사는 일시적인 통증 감소 효과를 제공하는 진통제와는 달리 통증의 원인이 되는 신경 기전에 직접 접근하는 VM202의 효과에 대해 재생의약 치료제로서의 가능성을 인정받은 것이라며, 우선심사 적용으로 FDA와 수시 접촉 창구가 생겨 시판 허가 심의 기간의 단축과 더불어 품목허가의 성공 가능성이 더욱 높아졌다고 밝힘."
2018-05-23,뉴프라이드,-8.48,美 뉴욕시 오락용 마리화나 합법화 TF 구성 소식에 급등,"▷일부 언론에 따르면, 美 뉴욕시 당국이 오락용 마리화나 합법화에 대한 TF(태스크포스)를 구성하고 관련 타당성 검토에 나선 것으로 전해짐. 이와 관련, TF는 오락용 마리화나 합법화 이후 경찰의 대응 방안, 마리화나 재배소 관리, 공공 캠페인의 필요성 등에 대한 정책 방안을 분석할 방침인 것으로 알려짐.▷이 같은 소식에 동사가 미국에서 관련 사업을 추진하고 있는 점이 부각."
2018-05-23,아모텍,29.9,전장부품 관련 매출 성장 전망에 강세,"▷하이투자증권은 동사에 대해 세라믹칩, 안테나, BLDC 모터 등 전사적인 측면에서 전장 부품으로 매출처를 다변화하고 있다고 밝힘. 이에 따라, 올해 전장 부품 관련 매출이 전년대비 50% 가까이 상승한 900억원 수준으로 예상돼 전사 매출의 28%를 차지할 것으로 전망.▷BLDC 모터의 경우 LED쿨링팬, 인카센서, 배터리쿨링팬 등으로 올해 매출 확대의 가시성이 가장 높고, 고수익성의 세라믹칩은 고객사의 AVN, 카메라 등의 확대에 따라 완만하게 성장 중이라고 분석. 또한, 안테나의 경우 당장의 가시성은 떨어지나 진행되는 프로젝트가 많아 향후 급격한 성장이 기대된다고 밝힘.▷투자의견 : 매수[신규], 목표주가 : 41,000원[신규]"
2018-05-23,클래시스,17.13,실적 개선 기대감에 상승,"▷하나금융투자는 동사에 대해 2분기 연결 기준 매출액과 영업이익이 각각 117억원(전년동기대비+21.1%), 39억원(전년동기대비+26.4%)을 기록할 것으로 전망. 이는 클래시스의 3월 대만 신규 진출 효과 및 계절적 성수기 진입, 주력 제품군 보급 확대에 따른 소모품 수요 때문이라고 밝힘. ▷투자의견 : 매수[유지], 목표주가 : 9,500원[유지]"
2018-05-23,프로스테믹스,13.49,지방유래 줄기세포 치료 가능성 확인 소식에 상승,"▷동사는 언론을 통해 서울아산병원 이비인후과 장용주 교수와 공동 연구를 통해 자체 개발한 지방유래 줄기세포 플랫폼 기술인 'ASF(Advanced adipose-derived Stem cell Fraction)™' 기술의 직접 치료 효과를 확인했다고 밝힘. 이번 연구는 빈코증후군 환자를 대상으로 진행됐으며, 그 결과는 국제학술지 'CEO(Clinical and Experimental otorhinolaryngology)' 최신호에 게재됐음.▷한편, ASF는 동사가 자체 개발한 원천 기술로, 특정 세포로의 분화를 앞두고 있는 줄기세포와 특정 세포로 이미 분화된 다양한 세포를 혼합한 상태로 활용하는 것이 특징임."
2018-05-23,뉴프렉스,13.39,무상증자 결정에 상승,"▷동사는 보통주 1주당 신주 0.5주를 배정하는 무상증자를 결정했다고 공시. 신주배정기준일은 2018년6월11일이며, 신주상장예정일은 2018년7월2일임."
2018-05-23,RFHIC,9.52,5G 전환 수혜 기대감에 상승,"▷토러스투자증권은 동사에 대해 향후 4G LTE에서 5G로 전환될 경우 동사의 GaN 트랜지스터가 기존 LDMOS(Laterally Diffused Metal Oxide Semiconductor)를 대체할 것으로 전망.▷이와 관련, GaN 트랜지스터의 경우 3.5GHz 이상 밴드에 대한 호환성이 우수하고, SiC(Silicon Carbide)기판 사용으로 기존 실리콘 기판 대비 5배 높은 방열성을 보유하고 있다며, LDMOS대비 50% 작은 크기를 구현해 낼 수 있어 향후 5G 투자에 따른 직접적인 수혜가 예상된다고 밝힘.▷이에 동사의 올해 매출액 및 영업이익이 각각 1,123억원(yoy +81.0%), 198억원(yoy +145.8%)을 기록해 창사 이래 최대 실적을 달성할 것으로 전망.▷투자의견 : 매수[신규], 목표주가 : 31,600원[신규]"
2018-05-23,바이오니아,9.09,실적 개선 및 체지방감소 유산균 파이프 라인 기대감에 상승,"▷SK증권은 동사에 대해 분자진단 사업부문의 고성장 등으로 2분기 기준 흑자전환이 예상된다고 분석. 또한, 동사의 분자 진단장비의 단가가 경쟁사대비 50% 수준으로, 유럽/아프리카/동남아 시장 내에서 점유율을 높여갈 것으로 분석.▷아울러, 세계적으로 희소한 항비만 효능을 가진 유산균(BNR17)이 최근 다수의 다국적 제약사와 남미/아시아/호주 등의 시장을 대상으로 기술이전 계약을 위해 막바지 협상을 진행 중이라고 밝힘. 이에 유산균 사업부문에서도 유의미한 신규매출이 발생하기 시작했다고 밝힘.▷투자의견 : 매수[신규], 목표주가 : 18,000원[신규]"
2018-05-23,모트렉스,8.91,콘티넨탈 코리아와 전장부품 공동개발 MOU 체결 소식에 상승,"▷동사는 언론을 통해 글로벌 자동차 전장 부품 기업인 콘티넨탈과 함께 전장제품 공동개발에 대한 양해각서(MOU)를 체결했다고 밝힘. 양사는 이번 협약을 통해 버튼 카드키, 스마트키 시스템, 디지털 클러스터 등을 개발할 예정임.▷이와 관련, 동사 관계자는 ""콘티넨탈로부터 국내를 대표하는 차량용 인포테인먼트 전문기업으로 인정받아 양해각서를 체결했다""며, ""이번 파트너십을 기반으로 전략적인 협력을 통해 가파르게 성장하는 시장인 중국, 이란 등 진출을 추진하고 있다""고 밝힘."
2018-05-23,케이엠더블유,8.13,5G 상용화에 따른 최대 수혜주 분석에 상승,"▷토러스투자증권은 동사에 대해 5G에서는 송수신 거리와 속도를 향상시키기 위해 최소 안테나가 32개 들어있는 32T32R에서 최대 64T64R 기술을 사용할 것으로 보이며, 이에 안테나와 필터 수요가 크게 증가할 것으로 전망.▷아울러 올해 매출 2,953억원(+45.0% yoy), 영업이익 251억원(흑자전환)을 기록할 것으로 전망. 이는 하반기 국내 통신사 5G 관련 장비 발주 및 인도 4.5G에 대한 투자 확대에 따른 신규 매출과 속적인 원가 및 비용 절감에 따른 LED 사업부문 적자폭 축소 때문으로 분석."
2018-05-23,알에스오토메이션,7.56,최대주주 및 특수관계자 보유주식 자진보호예수에 상승,▷동사는 경영안정성 및 지속성 확보를 위하여 최대주주 및 특수관계자 보유주식 전량(301만주)에 대하여 자진보호예수 했다고 공시. 보호예수기간은 2018년5월21일 부터 2018년12월31일 까지임.
2018-05-23,테라젠이텍스,6.04,항암신약 벡토서팁 임상 안정 및 유효성 확보 소식에 상승,▷동사는 언론을 통해 자회사인 메드팩토의 항암신약 '벡토서팁'의 제1상 임상시험에서 안전성과 탐색적 유효성을 확인했다고 밝힘. 아울러 메드팩토는 현지시간 6월1일부터 5일까지 미국 시카고에서 열리는 미국임상종양학회(ASCO)에서 임상의 중간결과를 발표할 것으로 알려짐.
2018-05-23,유진테크,5.08,SK하이닉스 中 법인과 111.67억원 규모 반도체 제조장비 공급계약 체결에 상승,"▷동사는 SK hynix Semiconductor(China) Ltd.(SKHYCL)와 111.67억원 규모의 반도체 제조장비 공급계약을 체결했다고 공시. 이는 지난해 매출액 대비 8.58% 규모이며, 계약 기간은 2018년5월23일부터 2018년7월30일까지임."
2018-05-23,스튜디오드래곤,-4.62,올해 실적 개선 기대감에 소폭 상승,"▷신한금융투자는 동사에 대해 올해 연결 매출액은 3,667억원(+27.9% YoY), 영업이익은 661억원(+100.4% YoY)을 기록할 것으로 전망. 이는 해외 드라마 수주 및 제작 본격화, 넷플릭스로의 기존 드라마 판매 가속화 전망, 중국 내 한국물에 대한 정기 쿼터 허용 가능성 때문으로 분석.▷투자의견 : 매수[유지], 목표주가 : 118,000원 → 132,000원[상향]"
2018-05-23,와이제이엠게임즈,-5.69,VR게임 '오버턴 : 파이널 오퍼레이션' VR카페 독점 공급 소식에 소폭 상승,▷동사는 언론을 통해 VR게임 '오버턴 : 파이널 오퍼레이션'을 오프라인 VR카페 'ENTER VR'와 'VRIZ VR'에 독점 공급한다고 밝힘. ‘오버턴 : 파이널 오퍼레이션’은 스팀 VR차트 톱 셀러 1위를 기록한 인기 게임 ‘오버턴’의 세계관에 최대 4명까지 전세계 플레이어들과 협력 플레이를 즐길 수 있는 멀티플레이 FPS VR게임임.
2018-05-23,현진소재,-7.01,대규모 유상증자 결정에 급락,"▷동사는 지난 21일 장 마감 후 운영자금 조달을 위해 보통주 19,342,359주(499.99억원) 규모 일반공모증자를 결정했다고 공시. 신주 발행가액은 2,585원이며, 신주의 상장예정일은 2018년8월7일임."
2018-05-21,와이오엠,-7.26,대규모 자금 조달 결정 등으로 급등,"▷동사는 운영자금 조달을 위해 아이비케이투자증권 주식회사를 대상으로 80억원 규모의 무기명식 이권부 무보증 사모 전환사채를 발행키로 결정했다고 공시. 사채 만기일은 2021년5월23일임.▷아울러, 운영자금 조달을 위해 제이아이티에스(주) 등을 대상으로 150억원 규모의 무기명식 이권부 무보증 사모 전환사채를 발행키로 결정했다고 공시. 사채 만기일은 2021년6월10일이며 만기이자율은 3.0%임.▷한편, 동사를 상대로 주식회사 이에스인터내셔널이 제기한 주식인도 소송이 부산지방법원 서부지원으로부터 각하됐다고 공시."
2018-05-21,화진,-8.74,최대주주 변경에 급등,▷동사는 18일 장 마감 후 모건스탠리 앤 씨오 인터내셔널 피엘씨의 주식장내매수로 최대주주가 (주)메타센스에서 모건스탠리 앤 씨오 인터내셔널 피엘씨로 변경됐다고 공시. 변경 후 최대주주인 모건스탠리 앤 씨오 인터내셔널 피엘씨의 지분 소유비율은 4.88%임.
2018-05-21,현진소재,-15.52,인트로메딕 대상 49.99억원 규모 유상증자 결정에 급등,"▷동사는 지난 18일 장 마감 후 운영자금 마련을 목적으로 (주)인트로메딕 대상 1,705,320주(49.99억원) 규모 제3자배정 유상증자를 결정했다고 공시. 신주의 발행가액은 2,932원이며, 신주의 상장예정일은 2018년6월12일임."
2018-05-21,글로벌텍스프리,29.98,중국인 관광객 수 회복에 따른 수혜 기대감 등으로 급등,"▷키움증권은 동사에 대해 외국인 대상 내국세 환급 (텍스리펀드)대행 국내 1위 업체라며, 한중 관계 회복에 따른 유커의 귀환 수혜가 기대된다고 밝힘. 이와 관련 동사의 수익모델이 외국인 관광객들의 소비에 연동되는 구조이며, 외국인 국내 관광객 중 유커가 핵심이라고 밝힘.▷아울러 3월 중국인 관광객 수가 403,413명(+12% YoY)을 기록해 13개월만에 처음으로 다시 YoY 성장에 진입했다며, 3월 수준이 유지된다고 가정하면 올해 2분기 중국인 관광객수는 64%(YoY) 증가할 것으로 전망. ▷이에 올해 매출액 484억원(+47% YoY), 영업이익 84억원(+933% YoY)을 기록해 본격적인 실적 성장이 기대된다고 밝힘.▷한편, 동사는 지난 2월 1주당 가액을 100원에서 500원으로 병합하는 주식병합을 결정한 바 있으며, 이에 지난 4월30일부터 매매거래가 정지된 후 금일 거래가 재개됐음."
2018-05-21,카페24,29.69,온라인 쇼핑 시장 성장 수혜 기대감에 강세,"▷하이투자증권은 동사에 대해 신규 쇼핑몰 사업자들이 사업을 시작할 때 가장 우선적으로 찾는 1등 플랫폼으로 향후 온라인 쇼핑 시장성장의 수혜가 기대된다고 분석. 아울러, 국내 뿐만 아니라 일본을 시작으로 미주, 동남아시아 등으로 진출 국가를 확대할 예정이며, 이는 향후 동사의 성장 동력으로 자리잡을 것이라고 밝힘."
2018-05-21,승일,13.31,실적 개선 기대감에 강세,"▷하나금융투자는 동사에 대해 국내 에어졸 부문 MS 1위 업체로, 화장품 향 에어졸 수요 증가로 실적 개선이 기대된다고 분석.▷금일 신규추천 종목에 편입."
2018-05-21,인콘,10.71,120억 규모 CB 발행 결정에 상승,"▷동사는 18일 장 마감 후 운영자금 마련을 위해 120억원 규모의 무기명식 이권부 무보증 사모 전환사채를 발행키로 결정했다고 공시. 사채의 표면/만기 이자율은 각각 2%, 2% 이며, 사채만기일은 2021년5월24일임. 발행 대상은 주식회사 메리츠종금증권 등임."
2018-05-21,제이엠아이,9.81,85억원 규모 유형자산 처분 결정에 상승,"▷동사는 지난 18일 장 마감 후 유동성 확보 및 재무구조 개선을 목적으로 경기도 화성시 소재 토지 일부(5,619.86㎡)를 85억원에 처분키로 결정했다고 공시. 이는 자산총액대비 7.94% 규모이며, 처분예정일자는 2018년7월18일임."
2018-05-21,아이엠,9.31,권리락 효과로 상승,"▷동사는 지난 18일 장 마감 후 유상증자에 따른 권리락이 금일 발생한다고 공시. 기준가는 1,970원임."
2018-05-21,비에이치,8.75,실적 개선 기대감에 상승,"▷신한금융투자는 동사에 대해 올해 2분기 매출액 1,453억원(전년동기대비+23%), 영업이익 122억원(전년동기대비+22%)을 기록할 것으로 전망. 아울러 3분기부터는 본격적인 실적 개선이 시작될 것으로 전망. 이는 5월 말부터 시작될 북미 고객사向 OLED용 RFPCB공급 효과 때문이라고 밝힘.▷투자의견 : 매수[유지], 목표주가 : 31,000원[유지]"
2018-05-21,비디아이,8.28,90억원 규모 CB 발행 결정에 상승,"▷동사는 운영자금 마련을 위해 90억원 규모의 무기명식 이권부 무보증 사모 전환사채를 발행키로 결정했다고 공시. 사채만기일은 2023년5월24일이며, 발행 대상자는 KB증권 주식회사 등임."
2018-05-21,비아트론,7.44,저평가 분석에 상승,"▷하나금융투자는 동사에 대해 올해 매출액 1,299억원(전년대비+29%), 영업이익 307억원(전년대비+48%)을 기록하며 견조한 성장을 보일 것으로 전망. 반면, 동사는 올해 예상 실적 기준 PER이 6배 미만으로 일반적인 전공정 장비 업체들의 평균 PER이 10배 수준인 점을 감안할 때, 과도한 저평가 상태라고 분석.▷이와 관련, 동사에 대해 투자의견을 BUY로 유지하며 목표주가는 최근 OLED 밸류 체인 업체들의 벨류에이션 디스카운트를 반영해 하향 조정.▷투자의견 : BUY[유지], 목표주가 : 32,000원 → 23,000원[하향]"
2018-05-21,게임빌,6.63,신작 출시 기대감에 상승,▷동사는 언론을 통해 5월30일 드래곤플라이와 함께 신작 모바일 MMO게임 가디우스 엠파이어를 글로벌 출시한다고 밝힘. 신작과 관련하여 동사는 게임 내 거대한 전장인 천상대륙에서 이용자들이 펼치는 대규모 전쟁 천상대전이 핵심이라며 전략 시뮬레이션의 재미에 영웅을 육성하는 RPG적인 요소를 결합한 것이 특징이라고 밝힘.▷글로벌 신작 출시와 관련해 기대감이 부각되면서 금일 동사의 주가가 상승 마감.
2018-05-21,씨티씨바이오,6.38,"비아그라, 암세포 전이 가능성 차단 효과 입증 소식에 상승","▷외신에 따르면, 캐나다 오타와 대학병원 종양외과 전문의이자 암 연구실장인 레베카 아우어 박사 연구팀이 비아그라, 시알리스와 같은 발기부전 치료제와 독감 백신을 함께 투여해 고형암 수술 후 잔존 암세포의 전이를 차단할 수 있다는 연구결과를 발표한 것으로 전해짐.▷이와 관련, 아우어 박사 연구팀이 암 종양을 제거한 쥐를 대상으로 실험한 결과 암 세포 전이 가능성을 90% 이상 차단한 것으로 나타났으며, 연구팀은 이를 바탕으로 위암 환자 24명을 대상으로 임상 시험을 진행할 예정인 것으로 알려짐.▷이 같은 소식에 동사가 필름형 발기부전 치료제를 레바논에 수출한 점 등이 부각되며 금일 상승세를 기록."
2018-05-21,컴투스,6.26,신작 출시 기대감에 상승,"▷NH투자증권은 동사에 대해 5월 중 스카이랜더스모바일로 시작되는 하반기 5종 라인업과 관련된 출시 기대감이 고조될 것이라고 밝힘. 이에 신작 출시가 중요한 모멘텀 중 하나인 게임주의 특성상 출시 준비단계인 지금이 투자 적기로 판단된다고 밝힘.▷한편, 스카이랜더스모바일은 5월 중 글로벌 CBT 및 사전예약을 진행할 예정이며, 최근 FGT(Focus Group Test) 이후 IP 보유 게임사인 Activision의 반응이 상당히 좋았던 것으로 알려져 CBT 중 문제만 없으면 8월 출시가 가능할 것으로 전망.▷투자의견 : 매수[유지], 목표주가 : 240,000원[유지]"
2018-05-21,민앤지,5.94,계좌간편결제 수혜 기업 분석에 소폭 상승,"▷신영증권은 동사에 대해 자회사 세틀뱅크의 계좌간편결제 서비스 성장이 돋보일 것으로 전망. 특히, 계좌간편결제는 낮은 수수료를 장점으로 다양한 커머스, 간편결제 기업들이 도입했으며, 공격적인 마케팅으로 거래액 성장이 예상된다고 분석.▷이에 지난해 약 3조원의 거래액을 통해 118억원의 매출을 기록했고, 올해도 높은 성장으로 매출 성장을 견인할 것으로 전망.▷투자의견 : BUY[신규], 목표주가 : 30,000원[신규]"
2018-05-21,평화정공,5.51,선제적 구조조정으로 실적회복 전망에 소폭 상승,"▷삼성증권은 동사에 대해 선제적인 구조조정으로 올해 실적회복의 발판을 마련했다고 분석. 아울러 현대/기아차의 중국시장 판매 3월부터 회복 및 생산지 이동 영향으로 2020년까지 실적회복이 이어질 것으로 전망. ▷특히, 2분기에 이익비중이 높은 중국시장이 현대/기아차 판매회복에 따라 흑자 전환하면서 뚜렷한 실적회복을 기록할 것으로 전망.▷투자의견 : BUY[유지], 목표주가 : 13,000원[유지]"
2018-05-21,일진파워,5.3,한국동서발전과 36.76억원 규모 공사계약 체결에 소폭 상승,"▷동사는 18일 장 마감 후 한국동서발전(주)과 36.76억원 규모의 2018년 제7호기 B급 터빈, 보일러설비 계획예방정비공사(당진사업소) 계약을 체결했다고 공시. 이는 지난해 매출액 대비 2.61% 규모이며, 계약 기간은 2018년5월21일부터 2018년7월11일까지임."
2018-05-21,JYP Ent.,5.26,트와이스 컴백 및 신인 보이그룹 성장 기대감에 소폭 상승,"▷하이투자증권은 동사에 대해 트와이스 컴백 및 신인그룹 스트레이 키즈, 보이스토리(Boy Story) 등의 데뷔로 수익성 개선이 기대된다고 밝힘. 지난 4월 트와이스가 컴백 이후 호조를 이어가고 있는 가운데, 신인그룹 스트레이 키즈가 3월 26일 첫 번째 미니 앨범을 내고 본격 활동에 들어갔고 9월 중국을 타겟으로 한 보이스토리(Boy Story)가 데뷔할 예정이어서 중국에서의 성장성이 부각될 것으로 전망."
2018-05-21,솔고바이오,5.02,대규모 유상증자 결정에 급락,"▷동사는 지난 18일 장 마감 후  시설자금 및 운영자금 조달을 위해 보통주 42,000,000주(231억원) 규모의 주주우선공모 유상증자를 결정했다고 공시. 예정발행가액은 550원이며, 신주의 상장 예정일은 2018년8월10일임."
2018-05-18,엔시트론,4.82,"관계사 하임바이오텍, 英 바이오 기업과 MOU 체결 소식에 급등","▷동사는 언론을 통해 관계사인 하임바이오텍이 진단시약 관련 영국 바이오 기업 A사와 연구용 마이크로 알앤에이(miRNA) 진단키트의 유럽 및 세계 시장 진출을 위한 업무협약(MOU)을 체결하고 공동 마케팅을 추진하고 있다고 밝힘. 이에 하임바이오텍은 A사의 글로벌 바이오 판매 네트워크를 이용해 글로벌 마케팅을 확대할 예정임.▷한편, 동사는 지난 2일 바이오사업 진출을 위해 하임비오텍 지분 20%을 취득키로 결정한 바 있음."
2018-05-18,에프엔씨애드컬쳐,2.81,최대주주 변경에 강세,"▷동사는 (주)에스엠엔터테인먼트에 대한 제3자배정 유상증자 완료 및 주식양수도 계약 체결에 따라 최대주주가 주식회사 에프엔씨엔터테인먼트 외 7인에서 (주)에스엠엔터테인먼트로 변경됐다고 공시. 변경후 최대주주 지분율은 30.51%(13,483,865주)임.▷아울러 동사는 최대주주 변경에 따른 이미지 제고를 위해 사명을 주식회사 에스엠라이프디자인그룹으로 변경하기로 했다고 공시."
2018-05-18,하츠,1.97,대진침대 라돈 검출 논란 속 라돈 제거 사업 부각에 강세,"▷최근 침대·메트리스 기업 대진침대의 일부 제품이 폐암 유발물질 라돈 검출로 논란에 휩싸인 가운데, 라돈 제거 환기청정기를 판매중인 동사가 수혜주로 부각되고 있음. 동사가 판매중인 환기청정기 ‘비채(VICHAE)’는 기존 공기청정기로 제거할 수 없었던 이산화탄소(CO2), 휘발성유기화합물, 이산화질소(NO2), 일산화탄소(CO), 라돈(Radon) 등의 가스상 오염물질까지 제거 가능한 것으로 알려짐."
